Amazon's new robotic arm uses AI and suction cups to pick up and sort MILLIONS of diverse products,https://www.dailymail.co.uk/sciencetech/article-11417153/Amazons-new-robotic-arm-uses-AI-suction-cups-pick-sort-MILLIONS-diverse-products.html?ns_mchannel=rss&ns_campaign=1490&ito=1490,"Amazon's new robotic arm is capable of handling and sorting millions of unique items - a major milestone for the ecommerce giant - and a sign that it could one day replace a large number of its human warehouse workers. The robotic arm, dubbed Sparrow, is powered by a combination of artificial intelligence, computer vision and suction cups. It is able to deftly pick up and move items that vary in shape, size and texture. Although the company has long featured a range of different automation in its gigantic fulfillment centers, Sparrow is the first Amazon robot able to discern so many items and, as such, could render many warehouse workers obsolete in the future. Amazon's new robotic arm is capable of handling and sorting millions of unique items - a major milestone for the ecommerce giant  The robotic arm, dubbed Sparrow, is powered by a combination of artificial intelligence, computer vision and suction cups.",2022-11-11T18:53:54Z
Multi-disciplinary Trends in Artificial Intelligence,https://link.springer.com/book/10.1007/978-3-031-20992-5,"This is a preview of subscription content, access via your institution. The 14 full papers and 5 short papers presented were carefully reviewed and selected from 42 submissions.",2022-11-11T17:45:46Z
BNamericas - How artificial intelligence can prevent mini...,https://www.bnamericas.com/en/interviews/how-artificial-intelligence-can-prevent-mining-accidents-and-save-lives,"Chile's mining industry reported 58 accidents and 68 deaths in the last five years (2017-21), according to geology and mining bureau Sernageomin. Those grim figures could change with the internet of things and artificial intelligence through metrics and predictive models that manage human errors and save lives. That is the technological option of a local start-up, Gauss Control, which in 2020 received recognition from the MIT Technology Review as one of the main innovators in Latin America. Today it monitors more than 20,000 workers, many in the mining industry, where most accidents are caused by the operation of equipment such as trucks, buses, pick-ups, mechanical shovels, etc. To find out how new technological devices can help reduce accidents and fatalities in the mining sector, BNamericas spoke with José Rafael Campino, founder and CEO of Gauss Control.",2022-11-11T17:45:19Z
GitHub - doccano/doccano: Open source annotation tool for machine learning practitioners.,https://github.com/doccano/doccano,"It provides annotation features for text classification, sequence labeling and sequence to sequence tasks. So, you can create labeled data for sentiment analysis, named entity recognition, text summarization and so on. Just create a project, upload data and start annotating. You can build a dataset in hours. You can try the annotation demo.",2022-11-11T17:45:12Z
"Canva Unveils Free For Use Text-To-Image AI, Here's What It Can Do",https://www.news18.com/news/tech/canva-unveils-free-for-use-text-to-image-ai-heres-what-it-can-do-6362839.html,"Several text-to-image AI tools are finding the limelight lately – from OpenAI's Dall-e to open-source Stable Diffusion. It is safe to say that text-to-image AI tools are here to stay, thanks to widespread use cases. Now, to ingrate a text-to-image AI tool in a mainstream application, the famous design app Canva has integrated the open-source Stable Diffusion to offer the AI tool to its more than 100 million users. Using free and Pro versions of Canva, users can generate up to 100 images daily, with due safety filters in place. Canva's text-to-image AI presents users with multiple styles, including photo, drawing, painting, pattern and concept art.",2022-11-11T17:45:06Z
"US, EU plan AI road map at upcoming trade, technology council meeting",https://www.rappler.com/technology/us-eu-plan-ai-road-map-trade-council-meeting/,"The United States and the European Union plan to release a new artificial intelligence road map that prioritizes security and risk management at the next meeting of their joint trade and technology council, a senior US official said on Thursday. Marisa Lago, commerce undersecretary for international trade, told an event hosted by the US Chamber of Commerce that the document would be released at the next ministerial meeting of the US-EU Trade and Technology Council, on December 5.  ""We think that this is a mutual priority that is going to grow in scope as new AI applications come online and as more authoritarian regimes are taking a very different approach to the issues of security and risk management,"" she said. Lago said US and EU officials felt the document would be integral to ensuring that new technologies were deployed in line with shared democratic values and free-market principles. It should also help ensure that small- and medium-sized US and EU businesses are not locked out of new digital markets. US Secretary of Commerce Gina Raimondo met virtually with EU Commission Executive Vice President Margrethe Vestager on Wednesday to discuss TTC work, with a focus on issues such as artificial intelligence, semiconductors and information communication technology services, the Commerce Department said.",2022-11-11T17:42:51Z
"The Roomba J7  just hit a new all-time low price, plus more of the best deals of the day",https://mashable.com/article/best-deals-day-nov-11,"We've rounded up the best deals of the day from everyone's favorite big box retailers on Nov. 11 -- here are our top picks:  BEST HOME DEAL: iRobot Roomba J7  Robot Vacuum(opens in a new tab) -- $595 $799.99 (save $204.99) BEST TECH DEAL: LG 48-inch A2 Series OLED 4K Smart webOS TV(opens in a new tab) -- $569.99 $1,299.99 The biggest shopping season of the year is upon us, with retailers casually dropping Black Friday discounts daily. Take today, Nov. 11, for example. Best Buy just launched another three-day sale within its ongoing Black Friday sale.",2022-11-11T17:25:01Z
Ring's Video Doorbell drops to $60 ahead of Black Friday,https://www.engadget.com/rings-video-doorbell-drops-to-60-ahead-of-black-friday-170912549.html?src=rss,"If you've been waiting for the holiday shopping season to grow your smart home ecosystem without dropping unnecessary amounts of money, you're in luck. Ahead of Black Friday, Amazon has already knocked down the price of the standard Ring Video Doorbell to $60. That's $15 cheaper than it was during Prime Day in July earlier this year and the best price we've seen it. There are a couple of compelling bundles you could get, too: pair the Video Doorbell with an Echo Show 5 for only $10 more, or get it with a battery-operated Ring Stick Up Camera for a total of $160. Amazon knocked 40 percent off the standard Ring Video Doorbell, bringing it down to the lowest price we've seen.",2022-11-11T17:09:12Z
Japan vies for 'last chance' as major global chip producer,https://apnews.com/article/technology-business-japan-82eb85980ec714d1ca9f5edbd513ae7e,"Japan is investing almost half a billion dollars to beef up semiconductor development and production in a ""last chance"" attempt to keep its position as a major player on the global technology stage, the government said Friday. The new company Rapidus, which means ""quick"" in Latin, will work on developing next-generation, or ""post-5G,"" semiconductors, according to the Ministry of Economy Trade and Industry. These advanced chips will allow for smart gadgets and smart cities with high-speed sensors and transmission. The components have to be extremely thin -- a fraction of a hair's breadth. The 70-billion-yen ($490-million) effort will involve working closely with major Japan ally the U.S. to bring together ""the best and the brightest"" from both nations, the ministry said in a statement.",2022-11-11T16:20:07Z
How small businesses can address the labor shortage realistically,https://www.mainebiz.biz/article/how-small-businesses-can-address-the-labor-shortage-realistically,"Mainebiz recently conducted a reader poll asking, ""What's the biggest challenge with the labor shortage?"" Among the four answer choices of (1) wage pressure, (2) finding qualified workers, (3) lack of workforce housing, and (4) retaining good employees, the overwhelming number of votes went to No. 2; finding qualified workers. As any small business owner knows, all the above issues actively contribute to the ongoing labor shortage, as well as others not listed, including a new examination of lifestyle and career choices. I learned long ago it's not good enough to just list problems without offering solutions, so here are some short and long-term ideas being tried around the country to help alleviate the situation. While companies can choose to adapt or work towards the above, they can also take a hard look at inefficiencies and turn to software technology to handle time-intensive administrative tasks, or automate inventory management and outsource where possible.",2022-11-11T16:05:35Z
Benefits of Determining the Uncertainty in Deep Neural Networks,https://medium.com/@timothylimyonglee/benefits-of-determining-the-uncertainty-in-deep-neural-networks-3eb95ee0d52c,"The CityScapes Dataset (open-source) is a dataset that focuses on the semantic understanding of urban street scenes. This dataset provides us with a pixel-level classification of images (Semantic Segmentation Task). With the data provided by Cityscapes, we will be able to train a Semantic Segmentation Model. After training, there definitely will be a lot of room to improve with potentially many weaknesses that we need to remediate or be aware of before we can apply such models in the industry for any particular application. The cityscapes dataset was collected all over Germany with the proportion of collected and unannotated data far outweighing the annotated data provided.",2022-11-11T16:05:20Z
Top Google Colab Alternatives For Machine Learning and Data Science Projects,https://www.marktechpost.com/2022/11/09/top-google-colab-alternatives-for-machine-learning-and-data-science-projects/,"Colaboratory, sometimes called ""Colab,"" is a Google Research product. It enables anyone to create and execute arbitrary Python code through the browser. Technically speaking, Colab is a hosted Jupyter notebook service that offers free access to computer resources, including GPUs, and requires no setup. As a better iteration of Jupyter Notebook, Google Colab can be characterized. Data analysis, teaching, and machine learning are three areas where Colab excels.",2022-11-11T16:05:16Z
Achieving Individual -- and Organizational -- Value With AI,https://sloanreview.mit.edu/projects/achieving-individual-and-organizational-value-with-ai/,"At Land O'Lakes, a member-owned cooperative agribusiness, farmers are using data and artificial intelligence to make smarter decisions. Over the past 30 years, corn farmers have used advances in bioengineering, chemicals, and analytics to boost their average yields by 50%, from 120 to 180 bushels per acre. Those advances pale in contrast to future corn yields that will be made possible using data and AI: Demonstrations promise to triple that average -- to 540 bushels per acre -- by the end of this decade. Farmers don't have to wait that long to see some of those benefits, however. Through extensive experimentation and complex algorithms, Land O'Lakes is already providing AI-driven recommendations to help individual farmers become more productive.",2022-11-11T16:05:09Z
Nathan Benaich: The State of AI Report,https://thegradientpub.substack.com/p/nathan-benaich-the-state-of-ai-report#details,"Have suggestions for future podcast guests (or other feedback)? Want to write with us? In episode 48 of The Gradient Podcast, Daniel Bashir speaks to Nathan Benaich. Nathan is Founder and General Partner at Air Street Capital, a venture capital (VC) firm focused on investing in AI-first technology and life sciences companies. Nathan runs a number of communities focused on AI including the Research and Applied AI Summit and leads Spinout.fyi to improve the creation of university spinouts.",2022-11-11T16:05:05Z
"Studying AI recruitment tools: race, gender, and AI's ""eradication of difference""",https://aihub.org/2022/11/11/studying-ai-recruitment-tools-race-gender-and-ais-eradication-of-difference/,"Philipp Schmitt & AT&T Laboratories Cambridge / Better Images of AI / Data flock (faces) / Licenced by CC-BY 4.0  Recent years have seen the emergence of AI tools marketed as an answer to lack of diversity in the workforce, from use of chatbots and CV scrapers to line up prospective candidates, through to analysis software for video interviews. Those behind the technology claim it cancels out human biases against gender and ethnicity during recruitment, instead using algorithms that read vocabulary, speech patterns and even facial micro-expressions to assess huge pools of job applicants for the right personality type and'culture fit'. However, in a new report published in Philosophy and Technology, researchers from Cambridge's Centre for Gender Studies argue these claims make some uses of AI in hiring little better than an'automated pseudoscience' reminiscent of physiognomy or phrenology: the discredited beliefs that personality can be deduced from facial features or skull shape. They say it is a dangerous example of'technosolutionism': turning to technology to provide quick fixes for deep-rooted discrimination issues that require investment and changes to company culture. In fact, the researchers have worked with a team of Cambridge computer science undergraduates to debunk these new hiring techniques by building an AI tool modelled on the technology, available online.",2022-11-11T16:03:09Z
