Which AI image details are most impacted by the text you type?,https://mlearning.substack.com/p/which-ai-image-details-are-most-impacted?r=z7zu8,"Prompt engineering is a machine learning and natural language processing (NLP) concept. In prompt engineering, the task description is contained in the input, e.g., in the form of a text, instead of being given implicitly. Effective text prompts must be delivered in a specific format. Unfortunately, text-based prompts need to be better documented, and generative systems and artists do not always share prompts. How to study the practices of text-based generative art?",2022-11-11T19:46:37Z
Ghostwrite: AI Email Writing Assistant,https://www.ghostwrite.rip/,Ghostwrite helps you write emails using artificial intelligence. Stop wasting time writing email and spending more time on conversations that matter to you.,2022-11-11T19:46:33Z
Amazon SageMaker Studio Lab continues to democratize ML with more scale and functionality,https://aws.amazon.com/blogs/machine-learning/amazon-sagemaker-studio-lab-continues-to-democratize-ml-with-more-scale-and-functionality/,"To make machine learning (ML) more accessible, Amazon launched Amazon SageMaker Studio Lab at AWS re:Invent 2021. Today, tens of thousands of customers use it every day to learn and experiment with ML for free. We made it simple to get started with just an email address, without the need for installs, setups, credit cards, or an AWS account. SageMaker Studio Lab resonates with customers who want to learn in either an informal or formal setting, as indicated by a recent survey that suggests 49% of our current customer base is learning on their own, whereas 21% is taking a formal ML class. Higher learning institutions have started to adopt it, because it helps them teach ML fundamentals beyond the notebook, like environment and resource management, which are critical areas for successful ML projects.",2022-11-11T19:30:18Z
"Rats can bop their heads in time to the beat of music, study reveals",https://www.dailymail.co.uk/sciencetech/article-11417773/Rats-bop-heads-time-beat-music-study-reveals.html?ns_mchannel=rss&ns_campaign=1490&ito=1490,"Most of us love to have a bit of a boogie, and some - but not all - can also keep to the beat! It turns out we're not alone in that, as a new study has found that rats can nod their heads in time to music. Researchers from the University of Tokyo played the rodents clips of Lady Gaga, Queen and Michael Jackson as well as a Mozart Sonata at four different tempos. Any bopping was recorded both on camera and with a miniature sensor strapped to their heads. 'Rats displayed innate - that is, without any training or prior exposure to music - beat synchronization most distinctly within 120-140 beats per minute (bpm),' said Associate Professor Hirokazu Takahashi.",2022-11-11T19:24:45Z
Amazon's new robotic arm uses AI and suction cups to pick up and sort MILLIONS of diverse products,https://www.dailymail.co.uk/sciencetech/article-11417153/Amazons-new-robotic-arm-uses-AI-suction-cups-pick-sort-MILLIONS-diverse-products.html?ns_mchannel=rss&ns_campaign=1490&ito=1490,"Amazon's new robotic arm is capable of handling and sorting millions of unique items - a major milestone for the ecommerce giant - and a sign that it could one day replace a large number of its human warehouse workers. The robotic arm, dubbed Sparrow, is powered by a combination of artificial intelligence, computer vision and suction cups. It is able to deftly pick up and move items that vary in shape, size and texture. Although the company has long featured a range of different automation in its gigantic fulfillment centers, Sparrow is the first Amazon robot able to discern so many items and, as such, could render many warehouse workers obsolete in the future. Amazon's new robotic arm is capable of handling and sorting millions of unique items - a major milestone for the ecommerce giant  The robotic arm, dubbed Sparrow, is powered by a combination of artificial intelligence, computer vision and suction cups.",2022-11-11T18:53:54Z
Multi-disciplinary Trends in Artificial Intelligence,https://link.springer.com/book/10.1007/978-3-031-20992-5,"This is a preview of subscription content, access via your institution. The 14 full papers and 5 short papers presented were carefully reviewed and selected from 42 submissions.",2022-11-11T17:45:46Z
BNamericas - How artificial intelligence can prevent mini...,https://www.bnamericas.com/en/interviews/how-artificial-intelligence-can-prevent-mining-accidents-and-save-lives,"Chile's mining industry reported 58 accidents and 68 deaths in the last five years (2017-21), according to geology and mining bureau Sernageomin. Those grim figures could change with the internet of things and artificial intelligence through metrics and predictive models that manage human errors and save lives. That is the technological option of a local start-up, Gauss Control, which in 2020 received recognition from the MIT Technology Review as one of the main innovators in Latin America. Today it monitors more than 20,000 workers, many in the mining industry, where most accidents are caused by the operation of equipment such as trucks, buses, pick-ups, mechanical shovels, etc. To find out how new technological devices can help reduce accidents and fatalities in the mining sector, BNamericas spoke with José Rafael Campino, founder and CEO of Gauss Control.",2022-11-11T17:45:19Z
GitHub - doccano/doccano: Open source annotation tool for machine learning practitioners.,https://github.com/doccano/doccano,"It provides annotation features for text classification, sequence labeling and sequence to sequence tasks. So, you can create labeled data for sentiment analysis, named entity recognition, text summarization and so on. Just create a project, upload data and start annotating. You can build a dataset in hours. You can try the annotation demo.",2022-11-11T17:45:12Z
"Canva Unveils Free For Use Text-To-Image AI, Here's What It Can Do",https://www.news18.com/news/tech/canva-unveils-free-for-use-text-to-image-ai-heres-what-it-can-do-6362839.html,"Several text-to-image AI tools are finding the limelight lately – from OpenAI's Dall-e to open-source Stable Diffusion. It is safe to say that text-to-image AI tools are here to stay, thanks to widespread use cases. Now, to ingrate a text-to-image AI tool in a mainstream application, the famous design app Canva has integrated the open-source Stable Diffusion to offer the AI tool to its more than 100 million users. Using free and Pro versions of Canva, users can generate up to 100 images daily, with due safety filters in place. Canva's text-to-image AI presents users with multiple styles, including photo, drawing, painting, pattern and concept art.",2022-11-11T17:45:06Z
"US, EU plan AI road map at upcoming trade, technology council meeting",https://www.rappler.com/technology/us-eu-plan-ai-road-map-trade-council-meeting/,"The United States and the European Union plan to release a new artificial intelligence road map that prioritizes security and risk management at the next meeting of their joint trade and technology council, a senior US official said on Thursday. Marisa Lago, commerce undersecretary for international trade, told an event hosted by the US Chamber of Commerce that the document would be released at the next ministerial meeting of the US-EU Trade and Technology Council, on December 5.  ""We think that this is a mutual priority that is going to grow in scope as new AI applications come online and as more authoritarian regimes are taking a very different approach to the issues of security and risk management,"" she said. Lago said US and EU officials felt the document would be integral to ensuring that new technologies were deployed in line with shared democratic values and free-market principles. It should also help ensure that small- and medium-sized US and EU businesses are not locked out of new digital markets. US Secretary of Commerce Gina Raimondo met virtually with EU Commission Executive Vice President Margrethe Vestager on Wednesday to discuss TTC work, with a focus on issues such as artificial intelligence, semiconductors and information communication technology services, the Commerce Department said.",2022-11-11T17:42:51Z
"The Roomba J7  just hit a new all-time low price, plus more of the best deals of the day",https://mashable.com/article/best-deals-day-nov-11,"We've rounded up the best deals of the day from everyone's favorite big box retailers on Nov. 11 -- here are our top picks:  BEST HOME DEAL: iRobot Roomba J7  Robot Vacuum(opens in a new tab) -- $595 $799.99 (save $204.99) BEST TECH DEAL: LG 48-inch A2 Series OLED 4K Smart webOS TV(opens in a new tab) -- $569.99 $1,299.99 The biggest shopping season of the year is upon us, with retailers casually dropping Black Friday discounts daily. Take today, Nov. 11, for example. Best Buy just launched another three-day sale within its ongoing Black Friday sale.",2022-11-11T17:25:01Z
Ring's Video Doorbell drops to $60 ahead of Black Friday,https://www.engadget.com/rings-video-doorbell-drops-to-60-ahead-of-black-friday-170912549.html?src=rss,"If you've been waiting for the holiday shopping season to grow your smart home ecosystem without dropping unnecessary amounts of money, you're in luck. Ahead of Black Friday, Amazon has already knocked down the price of the standard Ring Video Doorbell to $60. That's $15 cheaper than it was during Prime Day in July earlier this year and the best price we've seen it. There are a couple of compelling bundles you could get, too: pair the Video Doorbell with an Echo Show 5 for only $10 more, or get it with a battery-operated Ring Stick Up Camera for a total of $160. Amazon knocked 40 percent off the standard Ring Video Doorbell, bringing it down to the lowest price we've seen.",2022-11-11T17:09:12Z
Japan vies for 'last chance' as major global chip producer,https://apnews.com/article/technology-business-japan-82eb85980ec714d1ca9f5edbd513ae7e,"Japan is investing almost half a billion dollars to beef up semiconductor development and production in a ""last chance"" attempt to keep its position as a major player on the global technology stage, the government said Friday. The new company Rapidus, which means ""quick"" in Latin, will work on developing next-generation, or ""post-5G,"" semiconductors, according to the Ministry of Economy Trade and Industry. These advanced chips will allow for smart gadgets and smart cities with high-speed sensors and transmission. The components have to be extremely thin -- a fraction of a hair's breadth. The 70-billion-yen ($490-million) effort will involve working closely with major Japan ally the U.S. to bring together ""the best and the brightest"" from both nations, the ministry said in a statement.",2022-11-11T16:20:07Z
How small businesses can address the labor shortage realistically,https://www.mainebiz.biz/article/how-small-businesses-can-address-the-labor-shortage-realistically,"Mainebiz recently conducted a reader poll asking, ""What's the biggest challenge with the labor shortage?"" Among the four answer choices of (1) wage pressure, (2) finding qualified workers, (3) lack of workforce housing, and (4) retaining good employees, the overwhelming number of votes went to No. 2; finding qualified workers. As any small business owner knows, all the above issues actively contribute to the ongoing labor shortage, as well as others not listed, including a new examination of lifestyle and career choices. I learned long ago it's not good enough to just list problems without offering solutions, so here are some short and long-term ideas being tried around the country to help alleviate the situation. While companies can choose to adapt or work towards the above, they can also take a hard look at inefficiencies and turn to software technology to handle time-intensive administrative tasks, or automate inventory management and outsource where possible.",2022-11-11T16:05:35Z
Benefits of Determining the Uncertainty in Deep Neural Networks,https://medium.com/@timothylimyonglee/benefits-of-determining-the-uncertainty-in-deep-neural-networks-3eb95ee0d52c,"The CityScapes Dataset (open-source) is a dataset that focuses on the semantic understanding of urban street scenes. This dataset provides us with a pixel-level classification of images (Semantic Segmentation Task). With the data provided by Cityscapes, we will be able to train a Semantic Segmentation Model. After training, there definitely will be a lot of room to improve with potentially many weaknesses that we need to remediate or be aware of before we can apply such models in the industry for any particular application. The cityscapes dataset was collected all over Germany with the proportion of collected and unannotated data far outweighing the annotated data provided.",2022-11-11T16:05:20Z
Top Google Colab Alternatives For Machine Learning and Data Science Projects,https://www.marktechpost.com/2022/11/09/top-google-colab-alternatives-for-machine-learning-and-data-science-projects/,"Colaboratory, sometimes called ""Colab,"" is a Google Research product. It enables anyone to create and execute arbitrary Python code through the browser. Technically speaking, Colab is a hosted Jupyter notebook service that offers free access to computer resources, including GPUs, and requires no setup. As a better iteration of Jupyter Notebook, Google Colab can be characterized. Data analysis, teaching, and machine learning are three areas where Colab excels.",2022-11-11T16:05:16Z
Dentsu Breaks into the Metaverse,https://www.lbbonline.com/news/dentsu-breaks-into-the-metaverse,"Dentsu Metaversity for Microsoft Power Skills – Powerup Power Skills with new starter inductions, employee training, enabling teams anywhere to upskill and gain new competencies through the full suite of Microsoft 365 products, Text to speech and forthcoming Microsoft Designer capabilities. Microsoft Retail Education – a space for retailers and brands to learn more about Microsoft Dynamics 365 and dentsu's ShopNXT  retail innovations. Lounge - A virtual ""room"" where brands can connect through their professional LinkedIn identities to recruit, network, and engage with prospective buyers and customers. Ecosia Forest - Provides overall education on Ecosia - the search engine that plants trees where they are needed most, with over 160 million trees planted to date, powered by Microsoft. AI-Powered Virtual Human - our full experience will be guided by ""Neva,"" an AI-powered virtual human created in collaboration with HeadOffice.space.",2022-11-11T21:41:46Z
Legal NLP 1.2.0 for Spark NLP has been released!,https://gokhanturer.medium.com/legal-nlp-1-2-0-for-spark-nlp-has-been-released-%EF%B8%8F-8d060b3391ef,"We are excited to welcome the new 1.2.0 version of Legal NLP, including the following new capabilities. Legal NLP has been built on top of Spark NLP, which uses Spark MLLib pipelines. This means, You can have a common pipeline with any component of Spark NLP of Spark MLLib. Also, you combine it with the rest of our licensed libraries, such as Visual NLP, Healthcare NLP or Finance NLP. The library works on the top of Transformers and other Deep Learning architectures, providing state-of-the-art models which can be run on Spark Clusters.",2022-11-11T21:41:34Z
How To Create a Practical A.I. Risk Management Framework for Your Company,https://towardsai.net/p/l/how-to-create-a-practical-a-i-risk-management-framework-for-your-company,"Originally published on Towards AI the World's Leading AI and Technology News and Media Company. If you are building an AI-related product or service, we invite you to consider becoming an AI sponsor. At Towards AI, we help scale AI and technology startups. Let us help you unleash your technology to the masses. Simple steps to mitigate A.I. risks in a structured way  It's free, we don't spam, and we never share your email address.",2022-11-11T21:41:33Z
The evolution of Kratos,https://www.washingtonpost.com/video-games/2022/11/11/kratos-god-of-war-evolution-story/,"""I think a lot of people going in [to the reboot] had felt like Kratos was a pretty irredeemable character,"" said Matt Sophos, narrative lead on the latest entry in the series, ""God of War Ragnarok."" ""Going into the last one and then ['Ragnarok'], you know, we evolved that hopefully in most people's eyes."" Longtime fans were quick to portray the franchise's tonal shift as the ""daddification"" of Kratos; the change corresponded with the introduction of his son, Atreus, who accompanies his father through the realms of Norse mythology.",2022-11-11T21:28:12Z
Amazon's latest robot picker for warehouses uses AI to identify objects,https://www.engadget.com/amazon-robot-arm-picker-warehouse-sparrow-ai-computer-vision-210545438.html?src=rss,"Amazon has unveiled its latest warehouse robot. It says ""Sparrow is the first robotic system in our warehouses that can detect, select, and handle individual products in our inventory."" The robotic arm uses AI and computer vision to recognize and handle millions of items, according to Amazon. The company says that, by employing robots in its warehouses, it can conduct operations more efficiently and safely. ""Sparrow will take on repetitive tasks, enabling our employees to focus their time and energy on other things, while also advancing safety,"" Amazon said.",2022-11-11T21:05:45Z
The best Walmart deals on Nov. 11 include the Ecovacs Deebot N8  robot vacuum and Hasbro board games,https://mashable.com/deals/best-walmart-deals-of-the-day-nov-11,"We've rounded up all the best Walmart deals of the day on Nov. 11 -- here are our top picks:  BEST FLOOR CARE DEAL: EcoVacs Deebot N8  All-In-One Robot Vacuum Cleaner and Mop(opens in a new tab) -- $349 $649.99 (save $300.99)a BEST TOY DEAL: Games and puzzles from Hasbro, Endless Games, Goliath, and more(opens in a new tab) -- $10 (save up to $14.99)  Walmart's first Deals for Days(opens in a new tab) drop was pretty epic. The next one, which is set for Monday, Nov. 14 at 7 p.m. ET (12 p.m. ET for Walmart  members) surely won't disappoint either. If you completely missed the first one, no worries. While some popular products sold out pretty quickly, there are lots of great deals still live on the site -- including a premium cocktail machine for $80 off(opens in a new tab), a $50 Instant Pot Duo(opens in a new tab), and a $79 HP Chromebook(opens in a new tab).",2022-11-11T21:00:55Z
Introducing Deep Learning Into IT Industry,https://www.intelligentautomation.network/intelligent-automation-ia-rpa/articles/deep-learning-implementation-in-enterprise,"The term ""deep learning"" has firmly worked its way into the enterprise lexicon. Deep learning is a class of machine learning algorithms that uses a deep neural network in order to learn. A deep neural network is a collection of artificial neurons, which are simply trainable mathematical units. These neurons collectively ""learn"" complex mathematical functions to map raw input to an output. Neural networks have existed in machine learning since the 1950s, but today's ""deep"" networks have many more stacked layers of neurons than older networks.",2022-11-11T19:48:34Z
AI and Copyright Law: How Copyright Applies to AI-Generated Content - Trust Insights Marketing Analytics Consulting,https://www.trustinsights.ai/blog/2022/10/ai-and-copyright-law-how-copyright-applies-to-ai-generated-content/,"Who owns these fabulous works of art generated by systems and models like OpenAI's DALL-E or Stability.ai's What about blog content created by tools like GoCharlie or Copy.ai? To engage Ruth's services as an attorney, visit their website at GeekLawFirm.com. This interview does not constitute legal advice or create a client-attorney relationship with anyone. The information contained in this interview is presented on an ""as is"" basis with no guarantee of completeness, accuracy, usefulness, timeliness, or of the results obtained from the use of this information and without warranty of any kind, express or implied, including, but not limited to warranties of performance, merchantability, or fitness for a particular purpose. While we have taken every reasonable precaution to insure that the content is accurate, errors can occur. In all cases you should consult with a qualified professional familiar with your particular situation for advice concerning specific matters. What follows is an AI-generated transcript. The transcript may contain errors and is not a substitute for watching the video. Please note the following warning disclosure and disclaimer, this interview does not constitute legal advice or create a client attorney relationship with anyone.",2022-11-11T19:48:28Z
Nvidia's Impressive H100 MLPerf Benchmark,https://www.linkedin.com/pulse/nvidias-impressive-h100-mlperf-benchmark-jack-gold,"In the complex world of AI/ML processing, it can be hard to compare products from various vendors due to the wide range of models and workloads in use. MLPerf is a consortium of major industry players and research organizations that provides agreed-upon benchmark tests to try and standardize test results across various vendor offerings to give users a chance to evaluate competing performance claims. Nvidia has previously provided MLPerf test results for its A100 product. It has just released its MLPerf benchmarks for its new high end device, the H100. It sports an impressive 6.7X performance gain over the older A100 devices in certain workloads, and is still being optimized with software that could eventually push the performance even higher.",2022-11-11T19:48:17Z
Machine Learning Math: A Complete Guide to Machine Learning for Beginners with Tensorflow. This Book Explains How to Build Artificial Intelligence in Business Applications: ML & AI Academy: 9798647618702: Amazon.com: Books,https://www.amazon.com/Machine-Learning-Math-Intelligence-Applications/dp/B0892DCJR7,"You will learn four important things. The first one is how to implement games using gym and how to play games for relaxation and having fun. The second one is that you will learn how to preprocess data in reinforcement learning tasks such as in computer games. For practical machine learning applications, you will spend a great deal of time understanding and refining data, which affects the performance of an AI system a lot. The third one is the deep Q-learning algorithm.",2022-11-11T19:46:52Z
"11 Best Udemy Deep Learning Courses, Tutorials and Trainings in 2022",https://jadirectives.com/best-deep-learning-courses/,"Are you looking for Best Deep Learning Courses? This is also coming from the same two authors of the first one in this list; this Bestselling Course concentrates on Deep Learning. It will help you understand the intuition behind Artificial Neural Networks, Recurrent Neural Networks, Boltzmann Machines, Self Organizing Maps, and Auto-Encoders. You will also learn how to apply them. This deep learning certification tutorial will give you in-depth knowledge of deep learning.",2022-11-11T19:46:47Z
Which AI image details are most impacted by the text you type?,https://mlearning.substack.com/p/which-ai-image-details-are-most-impacted?r=z7zu8,"Prompt engineering is a machine learning and natural language processing (NLP) concept. In prompt engineering, the task description is contained in the input, e.g., in the form of a text, instead of being given implicitly. Effective text prompts must be delivered in a specific format. Unfortunately, text-based prompts need to be better documented, and generative systems and artists do not always share prompts. How to study the practices of text-based generative art?",2022-11-11T19:46:37Z
Ghostwrite: AI Email Writing Assistant,https://www.ghostwrite.rip/,Ghostwrite helps you write emails using artificial intelligence. Stop wasting time writing email and spending more time on conversations that matter to you.,2022-11-11T19:46:33Z
Amazon SageMaker Studio Lab continues to democratize ML with more scale and functionality,https://aws.amazon.com/blogs/machine-learning/amazon-sagemaker-studio-lab-continues-to-democratize-ml-with-more-scale-and-functionality/,"To make machine learning (ML) more accessible, Amazon launched Amazon SageMaker Studio Lab at AWS re:Invent 2021. Today, tens of thousands of customers use it every day to learn and experiment with ML for free. We made it simple to get started with just an email address, without the need for installs, setups, credit cards, or an AWS account. SageMaker Studio Lab resonates with customers who want to learn in either an informal or formal setting, as indicated by a recent survey that suggests 49% of our current customer base is learning on their own, whereas 21% is taking a formal ML class. Higher learning institutions have started to adopt it, because it helps them teach ML fundamentals beyond the notebook, like environment and resource management, which are critical areas for successful ML projects.",2022-11-11T19:30:18Z
"Rats can bop their heads in time to the beat of music, study reveals",https://www.dailymail.co.uk/sciencetech/article-11417773/Rats-bop-heads-time-beat-music-study-reveals.html?ns_mchannel=rss&ns_campaign=1490&ito=1490,"Most of us love to have a bit of a boogie, and some - but not all - can also keep to the beat! It turns out we're not alone in that, as a new study has found that rats can nod their heads in time to music. Researchers from the University of Tokyo played the rodents clips of Lady Gaga, Queen and Michael Jackson as well as a Mozart Sonata at four different tempos. Any bopping was recorded both on camera and with a miniature sensor strapped to their heads. 'Rats displayed innate - that is, without any training or prior exposure to music - beat synchronization most distinctly within 120-140 beats per minute (bpm),' said Associate Professor Hirokazu Takahashi.",2022-11-11T19:24:45Z
